{
  "manifest_version": 1,
  "skill_name": "slcli",
  "recommended_suites": {
    "gating": [1, 4, 5, 7, 10],
    "regression": [1, 2, 3, 4, 5, 6, 7, 8, 9, 10, 11],
    "live_readonly": [12, 13],
    "online": [1, 2, 3, 4, 5, 6, 7, 8, 9, 10, 11, 12, 13]
  },
  "evals": [
    {
      "id": 1,
      "tags": ["gating", "testmonitor", "analysis"],
      "prompt": "Show me all failed measurements on product BAT-MODEL-ABC-001 for the last month.",
      "expected_output": "Uses the testmonitor results surface to query recent failed results for a specific product and returns a command-oriented analysis path.",
      "files": [],
      "resource_prerequisites": [{"type": "test_result", "match": {"part_number": "BAT-MODEL-ABC-001"}}],
      "expectations": [
        "Selects the `testmonitor` command group rather than an unrelated resource group",
        "Uses JSON output when the result is intended for analysis or filtering",
        "Applies a product-specific filter and a failure-status filter",
        "Does not invent unsupported subcommands or flags"
      ],
      "grading_rules": [
        {
          "text": "Uses the testmonitor result surface",
          "critical": true,
          "positive_control": "slcli testmonitor result list",
          "negative_control": "slcli system list",
          "scope": "command",
          "mode": "any_of",
          "patterns": [
            "slcli\\s+testmonitor\\s+result\\s+list"
          ]
        },
        {
          "text": "Requests JSON output for analysis",
          "critical": false,
          "scope": "command",
          "mode": "any_of",
          "patterns": [
            "--format\\s+json",
            "-f\\s+json"
          ]
        },
        {
          "text": "Includes product and failed-status filters",
          "critical": true,
          "positive_control": "slcli testmonitor result list --part-number BAT-MODEL-ABC-001 --status FAILED",
          "negative_control": "slcli testmonitor result list --part-number BAT-MODEL-ABC-001",
          "scope": "command",
          "mode": "all_of",
          "patterns": [
            "(?:--part-number\\s+\"?BAT-MODEL-ABC-001\"?|(?=[^\\n]*--product-filter\\s+[^\\n]*@\\d+)(?=[^\\n]*--product-substitution\\s+\"?BAT-MODEL-ABC-001\"?))",
            "--status\\s+FAILED"
          ]
        },
        {
          "text": "Includes a parameterized last-month time window",
          "critical": true,
          "positive_control": "slcli testmonitor result list --filter \"startedAt >= @0 and startedAt < @1\" --substitution 2026-08-01T00:00:00Z --substitution 2026-09-01T00:00:00Z",
          "negative_control": "slcli testmonitor result list --part-number BAT-MODEL-ABC-001 --status FAILED",
          "scope": "command",
          "validator": "previous_calendar_month",
          "control_reference_date": "2026-09-08",
          "mode": "all_of",
          "patterns": [
            "--filter\\s+",
            "startedAt\\s*>=",
            "startedAt\\s*<",
            "--substitution\\s+"
          ]
        },
        {
          "text": "Combines product, status, and last-month filters in one invocation",
          "critical": true,
          "positive_control": "slcli testmonitor result list --part-number BAT-MODEL-ABC-001 --status FAILED --filter \"startedAt >= @0 and startedAt < @1\" --substitution 2026-08-01T00:00:00Z --substitution 2026-09-01T00:00:00Z",
          "negative_control": "slcli testmonitor result list --part-number BAT-MODEL-ABC-001 --status FAILED\nslcli testmonitor result list --filter \"startedAt >= @0 and startedAt < @1\" --substitution 2026-08-01T00:00:00Z --substitution 2026-09-01T00:00:00Z",
          "scope": "command",
          "validator": "previous_calendar_month",
          "control_reference_date": "2026-09-08",
          "mode": "all_of",
          "patterns": [
            "slcli\\s+testmonitor\\s+result\\s+list",
            "(?:--part-number\\s+\"?BAT-MODEL-ABC-001\"?|(?=[^\\n]*--product-filter\\s+[^\\n]*@\\d+)(?=[^\\n]*--product-substitution\\s+\"?BAT-MODEL-ABC-001\"?))",
            "--status\\s+FAILED",
            "startedAt\\s*>=\\s*@\\d+",
            "startedAt\\s*<\\s*@\\d+",
            "--substitution\\s+\\d{4}-\\d{2}-01"
          ]
        },
        {
          "text": "Avoids unsupported generic query commands",
          "critical": true,
          "positive_control": "slcli testmonitor result list",
          "negative_control": "slcli query results",
          "scope": "command",
          "mode": "none_of",
          "patterns": [
            "slcli\\s+query\\b",
            "slcli\\s+search\\b"
          ]
        }
      ]
    },
    {
      "id": 2,
      "tags": ["regression", "system"],
      "prompt": "Compare systems apm-pxi-2 and formation-station-REAL.",
      "expected_output": "Uses the system comparison workflow and provides a direct command or short sequence for comparing two systems.",
      "files": [],
      "resource_prerequisites": [
        {"type": "system", "match": {"name": "apm-pxi-2"}},
        {"type": "system", "match": {"name": "formation-station-REAL"}}
      ],
      "expectations": [
        "Selects the `system` command group",
        "Uses the compare-oriented system workflow instead of a generic list command",
        "Keeps the response scoped to the requested systems",
        "Prefers long-form flags if options are needed"
      ],
      "grading_rules": [
        {
          "text": "Uses the system compare command",
          "critical": true,
          "positive_control": "slcli system compare apm-pxi-2 formation-station-REAL",
          "negative_control": "slcli system list",
          "scope": "command",
          "mode": "any_of",
          "patterns": [
            "slcli\\s+system\\s+compare\\s+(?:apm-pxi-2\\s+formation-station-REAL|formation-station-REAL\\s+apm-pxi-2)"
          ]
        },
        {
          "text": "Avoids replacing compare with generic list output",
          "critical": true,
          "positive_control": "slcli system compare apm-pxi-2 formation-station-REAL",
          "negative_control": "slcli system list",
          "scope": "command",
          "mode": "none_of",
          "patterns": [
            "slcli\\s+system\\s+list"
          ]
        }
      ]
    },
    {
      "id": 3,
      "tags": ["regression", "system", "summary"],
      "prompt": "Give me a summary of system WinDev2302Eval measurement capabilities.",
      "expected_output": "Uses the system resource workflow to inspect one system and summarize capabilities without drifting into unrelated resource types.",
      "files": [],
      "resource_prerequisites": [{"type": "system", "match": {"name": "WinDev2302Eval"}}],
      "expectations": [
        "Selects the `system` command group",
        "Uses a get or inspection-oriented command before summarizing",
        "Does not switch to asset or tag commands unless justified",
        "Keeps the workflow focused on one named system"
      ],
      "grading_rules": [
        {
          "text": "Uses a system inspection command for the named system",
          "critical": true,
          "positive_control": "slcli system get WinDev2302Eval",
          "negative_control": "slcli system get OtherSystem",
          "scope": "command",
          "mode": "any_of",
          "patterns": [
            "slcli\\s+system\\s+get\\s+WinDev2302Eval",
            "slcli\\s+system\\s+list[^\n]*--alias\\s+WinDev2302Eval"
          ]
        },
        {
          "text": "Avoids drifting into unrelated command groups",
          "critical": true,
          "positive_control": "slcli system get WinDev2302Eval",
          "negative_control": "slcli asset list",
          "scope": "command",
          "mode": "none_of",
          "patterns": [
            "slcli\\s+asset\\s+",
            "slcli\\s+tag\\s+"
          ]
        }
      ]
    },
    {
      "id": 4,
      "tags": ["gating", "testmonitor", "filters", "safety"],
      "prompt": "Show me failed BATT-8 tests from operator xli in June 2022.",
      "expected_output": "Builds a filtered testmonitor query that combines convenience filters and safe parameterized filtering for compound conditions.",
      "files": [],
      "resource_prerequisites": [{"type": "test_result", "match": {"part_number": "BATT-8"}}],
      "expectations": [
        "Selects the `testmonitor` command group",
        "Combines multiple conditions instead of suggesting manual post-processing only",
        "Uses `--substitution` when composing a complex filter rather than string interpolation",
        "Uses JSON output if the command is meant to be further analyzed"
      ],
      "grading_rules": [
        {
          "text": "Uses the testmonitor result list command",
          "critical": true,
          "positive_control": "slcli testmonitor result list",
          "negative_control": "slcli testmonitor product list",
          "scope": "command",
          "mode": "any_of",
          "patterns": [
            "slcli\\s+testmonitor\\s+result\\s+list"
          ]
        },
        {
          "text": "Includes part and operator constraints",
          "critical": true,
          "positive_control": "slcli testmonitor result list --part-number BATT-8 --filter 'operator = xli'",
          "negative_control": "slcli testmonitor result list --part-number BATT-8",
          "scope": "command",
          "mode": "all_of",
          "patterns": [
            "BATT-8",
            "xli"
          ]
        },
        {
          "text": "Uses substitutions for a complex filter",
          "critical": true,
          "positive_control": "slcli testmonitor result list --operator xli --filter \"startedAt >= @0 and startedAt < @1\" --substitution 2022-06-01 --substitution 2022-07-01",
          "negative_control": "slcli testmonitor result list --filter operator=xli",
          "scope": "command",
          "mode": "all_of",
          "patterns": [